{
  "task_id": "EXT-ACTIONS-ROOTCAUSE-001",
  "timestamp": "2026-04-14T21:34:34Z",
  "event": "DONE",
  "status": "ok",
  "owner": "Codex",
  "agent_app": "Codex",
  "session_id": "codex-20260414-213200",
  "message": "Resolved: private-repo gating removed, default Code Scanning conflict removed, docs-history check made consistent, and Protect main ruleset aligned to emitted check names. PR #4 merged successfully.",
  "artifacts": ["docs/github/actions-root-cause-incident.md","docs/collab/current-state.md"],
  "questions": []
}
