{
  "task_id": "EXT-ACTIONS-ROOTCAUSE-001",
  "timestamp": "2026-04-14T20:54:31Z",
  "event": "INFO",
  "status": "ok",
  "owner": "The Launch Pad - TLP",
  "agent_app": "Codex",
  "session_id": "codex-20260414-203500",
  "message": "Follow-up diagnosis: repo-wide Actions execution recovered after repo became public; remaining blocker was workflow/ruleset design. Disabled default Code Scanning setup, hardened custom CodeQL, and changed Docs History Validation to always emit the required PR check.",
  "artifacts": ["docs/github/actions-root-cause-incident.md",".github/workflows/codeql.yml",".github/workflows/docs-history.yml","docs/collab/current-state.md"],
  "questions": []
}
